{
  "session": 2,
  "ai": "Claude",
  "model": "claude-sonnet-4-6",
  "speed": "not-applicable",
  "effort": "high",
  "status": "READY_FOR_REVIEW",
  "base_commit": "a8c49c95249d7c9d6f295b480deae801587af369",
  "final_commit": "96b4a50eab1c2c65dd3ca39242f121457e7f9779",
  "branch": "ai/session-02-claude-package-skeleton",
  "patch_checksum": null,
  "punch_items": [
    {
      "id": "ARCH-001",
      "role": "package-skeleton slice (full closure in Session 08)",
      "status": "implemented",
      "evidence": "pathminer/ package with 9 sub-package __init__.py stubs created; pyproject.toml enables `pip install -e .`; smoke-import test verifies all 10 modules import cleanly. Done-when clause requires application to run from package — deferred to Session 08 per SESSION_STATUS.csv."
    },
    {
      "id": "ARCH-002",
      "role": "closure owner",
      "status": "verified",
      "evidence": "tests/test_import_boundaries.py: 37 tests, all PASS (0.02 s). Covers: core forbidden external (Qt/wx/KiCad/I-O), core forbidden internal (kicad/ui/storage/plugin/report/cli), kicad no-Qt/no-wx, headless layers (models/analysis/report/storage/cli) no-Qt/no-wx, plugin no-Qt, universal no-ui (8 sub-packages + root __init__), smoke imports (10 modules), self-check (3 tests confirm guard detects violations). Done-when clause: 'an automated import-boundary test fails on a forbidden dependency' — satisfied: guard catches synthetic Qt and pathminer.ui imports in self-check tests."
    }
  ],
  "files": {
    "added": [
      "pyproject.toml",
      "pathminer/__init__.py",
      "pathminer/core/__init__.py",
      "pathminer/kicad/__init__.py",
      "pathminer/models/__init__.py",
      "pathminer/analysis/__init__.py",
      "pathminer/report/__init__.py",
      "pathminer/storage/__init__.py",
      "pathminer/cli/__init__.py",
      "pathminer/ui/__init__.py",
      "pathminer/plugin/__init__.py",
      "tests/test_import_boundaries.py",
      ".github/workflows/ci.yml"
    ],
    "modified": [],
    "removed": []
  },
  "apis_changed": [
    "New: pathminer.__version__ = '0.14.0.dev0'",
    "New console script: pathminer -> pathminer.cli:main (stub, exits with message)"
  ],
  "schemas_changed": [],
  "compatibility_consequences": [
    "tools/pcb_trace_resistance.py is unchanged; all v0.13 CLI and GUI interfaces unaffected.",
    "The pathminer package is a new addition; nothing previously depended on it."
  ],
  "tests": [
    {
      "command": "python3 tools/pcb_trace_resistance.py --selftest",
      "exit_code": 0,
      "result": "118/118 checks passed (pre-change baseline)",
      "runtime_seconds": 0.22
    },
    {
      "command": "python3 -m pytest -q",
      "exit_code": 0,
      "result": "no tests ran in 0.02s (pre-change — no pytest files existed yet)",
      "runtime_seconds": 0.02
    },
    {
      "command": "python3 -m pytest -q",
      "exit_code": 0,
      "result": "37 passed in 0.02s (post-change)",
      "runtime_seconds": 0.02
    },
    {
      "command": "python3 tools/pcb_trace_resistance.py --selftest",
      "exit_code": 0,
      "result": "118/118 checks passed (post-change, verifying no regression)",
      "runtime_seconds": 0.22
    }
  ],
  "decisions": [
    "Static AST analysis chosen for import guard (not runtime importlib): catches violations without executing code, works on empty stubs, no import side-effects.",
    "Version 0.14.0.dev0: pre-release signal; final versioning to be confirmed by coordinator before Resistance v1 milestone.",
    "json and other I/O libraries (csv, sqlite3, configparser, yaml, toml, pickle, shelve, dbm) forbidden in pathminer.core — serialisation belongs in storage/ and report/.",
    "wx allowed in pathminer.plugin (KiCad runtime provides it) but Qt forbidden in plugin/.",
    "CI lint step is non-blocking (continue-on-error: true) until QA-009 release gate.",
    "documents/change_log.md not updated — outside owned write scope; coordinator to add entry on integration."
  ],
  "assumptions": [
    "pathminer PyPI name is not claimed; coordinator to confirm before public release.",
    "pip install -e '.[dev]' resolves correctly in CI on Python 3.9+, setuptools>=68.",
    "PySide6 excluded from CI install; GUI tests deferred to UI sessions."
  ],
  "deviations": [],
  "known_issues": [
    "__pycache__/ directories not excluded by root .gitignore; coordinator should add **/__pycache__/ to root .gitignore during integration.",
    "ARCH-001 not fully closed: Done-when requires application to run from package, deferred to Session 08.",
    "pathminer.cli:main() stub exits with code 1; real CLI implemented in later session.",
    "documents/change_log.md not updated (outside owned scope)."
  ],
  "dependent_session_impact": [
    "Sessions 03-08 (code extraction, W2-A through W5): start from this commit; import-boundary test will catch violations during extraction.",
    "Session 08 (compatibility integration, W5): closes ARCH-001 by making application run from package; must pass all 37 boundary tests.",
    "All subsequent sessions: python3 -m pytest -q is now a valid pre-change baseline command (< 1 s).",
    "CI workflow active from first push of this branch; sessions pushing ai/session-* branches automatically get pytest + selftest coverage."
  ],
  "recommended_next_action": "Coordinator: integrate branch into main; add **/__pycache__/ to root .gitignore and a documents/change_log.md entry during integration; open Sessions 03, 04, and 05 (W2-A, W2-B, W2-C — parallel, disjoint write scopes) from the integrated commit."
}
