{
  "session": 5,
  "ai": "Claude",
  "model": "claude-sonnet-4-6",
  "effort": "high",
  "status": "READY_FOR_REVIEW",
  "base_commit": "ec9dba5f4d3cb88ede7caa8045e2011c09b25803",
  "final_commit": "c6c0a3faa371b3af746b24ff50c2a952c394f2ae",
  "branch": "ai/session-05-claude-kicad-parser",
  "patch_checksum": null,
  "punch_items": [
    {
      "id": "ARCH-003",
      "role": "Contributes named capability slice (parser foundation: sexpr, stackup, prefs)",
      "status": "implemented",
      "evidence": "pathminer/kicad/sexpr.py, pathminer/kicad/stackup.py, pathminer/kicad/prefs.py added; 146 tests pass; full suite 320 passed 0 failed"
    }
  ],
  "files": {
    "added": [
      "pathminer/kicad/sexpr.py",
      "pathminer/kicad/stackup.py",
      "pathminer/kicad/prefs.py",
      "tests/test_kicad_sexpr.py",
      "tests/test_stackup.py",
      "tests/test_prefs.py",
      "tests/fixtures/kicad/minimal_with_stackup.kicad_pcb",
      "tests/fixtures/kicad/no_stackup.kicad_pcb",
      "tests/fixtures/kicad/not_a_pcb.kicad_pcb",
      "tests/fixtures/kicad/single_copper.kicad_pcb"
    ],
    "modified": [],
    "removed": []
  },
  "apis_changed": [
    "pathminer.kicad.sexpr: Node, parse_sexpr (new public surface)",
    "pathminer.kicad.stackup: OZ_TO_UM, StackLayer, Stackup, load_stackup, manual_stackup (new public surface)",
    "pathminer.kicad.prefs: KICAD_VERSIONS, kicad_pref_dirs, kicad_recent_projects, board_for_project, project_for_board (new public surface)"
  ],
  "schemas_changed": [],
  "compatibility_consequences": [
    "No existing API modified; new modules are additive",
    "tools/pcb_trace_resistance.py is unchanged; monolith and new modules coexist",
    "Session 06 (board.py) should import from pathminer.kicad.sexpr and pathminer.kicad.stackup"
  ],
  "tests": [
    {
      "command": "python3 -m pytest -q",
      "exit_code": 0,
      "result": "174 passed in 1.02s (pre-change baseline)",
      "runtime_seconds": 1.02
    },
    {
      "command": "python3 -m pytest -q tests/test_kicad_sexpr.py tests/test_stackup.py tests/test_prefs.py",
      "exit_code": 0,
      "result": "146 passed in 0.50s",
      "runtime_seconds": 0.50
    },
    {
      "command": "python3 -m pytest -v",
      "exit_code": 0,
      "result": "320 passed in 1.64s (full post-change suite, 0 failed, 0 errors)",
      "runtime_seconds": 1.64
    },
    {
      "command": "python3 -m pytest -v tests/test_import_boundaries.py",
      "exit_code": 0,
      "result": "48 passed in 0.13s",
      "runtime_seconds": 0.13
    }
  ],
  "decisions": [
    "tools/pcb_trace_resistance.py was not modified (out of owned write scope)",
    "stackup.py imports sexpr.py within kicad/ package boundary — ARCH-002 compliant",
    "_unquote and _TOK are module-private (leading underscore) matching v0.13 convention",
    "harvest_vias() not extracted — it belongs to future board.py (board adapter) scope",
    "Class-scoped pytest fixtures converted to @classmethod to suppress pytest 10 deprecation warning",
    "Minimal synthetic .kicad_pcb fixtures used for failure/boundary tests; IP5385 board used only for parity regression"
  ],
  "assumptions": [
    "pathminer/kicad/__init__.py was created by a prior session (confirmed at base commit)",
    "Session 02 is the prerequisite session (confirmed: Session_02_Claude.md/json present in handoffs/)",
    "IP5385 reference board at ai_reference/kicad_project_example/Ref_PowerBank_injoinic_IP5385_v0.8.kicad_pcb has 0.035mm inner layers (confirmed by load_stackup inspection)",
    "Session 03 test_resistance.py GEO_ON/GEO_OFF fixture uses 0.070mm inner layers from a different reference stackup, not the IP5385 board — this is not a contradiction"
  ],
  "deviations": [],
  "known_issues": [],
  "dependent_session_impact": [
    "Session 06 (board.py / FileBoardSource): should import pathminer.kicad.sexpr and pathminer.kicad.stackup; public API is stable",
    "Sessions using KiCad parsing in the package can import from these modules instead of the monolith",
    "test_resistance.py (Session 03): not affected; its hand-derived GEO fixture remains valid independently of this extraction"
  ],
  "recommended_next_action": "Coordinator: assign reviewer or integrate and open Session 06 (board.py / FileBoardSource) which depends on sexpr.py and stackup.py from this session"
}
